{"content_transport_certified":false,"governance_authority_granted":false,"implementation_head":{"commit":"829e654b2df0225a901d49b84ef37a95d5b04752","tree":"22a72d6f4d59060c9ade16889ac031bf387cbab6"},"lookup_key":"KC144.V1::MYCELIUM_LOCATABLE_TOOL_DISPATCH","meaning_of_authoritative":"SELECTED_CODE_IDENTITY_FOR_DETERMINISTIC_REPLAY_ONLY","publication_parent":{"commit":"4f3bd71a1e88130109edd03437b72f21c0e14096","tree":"c15740c445baa1f98e20b3172fb8637c9b44271a"},"registry_digest":"sha256:5411bcd7c8e875b429004ecfd63b19fe35998b48e0c7ff685f90176ae15fbc62","repository":"demeet2k/guild-hall","schema":"KC144.DispatchHeadRegistry.V1","source_heads":{"KC144.P31::LIVE_COGNITION_NAVIGATE":{"archive_digest":"sha256:77629d53ef00c970cf115d7cbf94d5e4c9b97928814a702ada8d3f883212d091","release_id":"KC144_P31_LIVE_COGNITION_OS_V3_3","result_id":"KC144.P31::db5a6446ce54cf4bc53515be","structural_parent_result_id":"KC144.P30::1f40beaa81e8c0ba956ce835"},"KC144.V1::CONTENT_ADDRESSED_AGENT_RUN_RECEIPTS":{"bundle_digest":"sha256:52b8b2896a7bd1fff45dc3df84ac031172a3bc469375e3d3c775c8e9cb0aef59","commit":"4f3bd71a1e88130109edd03437b72f21c0e14096","run_id":"sha256:0277d691593684417720414f2a2fd00436811e86d946cdc4eb2b1c0e975beb04","runtime_commit":"91cf0e3c2e8da10ed0787ebf1c0c0105aaf988a9","runtime_tree":"bc44c4f14b25894a8251e8c1289b718e04eef32a"},"KC144.V1::PARALLEL_ROUTE_CRYSTAL":{"commit":"475259f5ca3e5da3528eddda59f411baf37e57c0","content_digest":"sha256:c8e1a1a7c55a144b7bf20b49ff3fd01ca292a0cd34f134ce0a0abf0d9ac0bc1d"}},"standing":"FROZEN_PUBLIC_CODE_IDENTITY","supersedes_registry_digest":null,"truth_effect":"NONE"}
